[
  {
    "schema_version": 1,
    "workload": "major",
    "candidate": "rugix-pipeline-casync16",
    "repetition": 0,
    "rtt_ms": 0,
    "seconds": 35.372,
    "body_bytes": 342120900,
    "server_body_bytes": 342120900,
    "partial_http_responses": 0,
    "retransmitted_tcp_payload_bytes": 1769,
    "download_bytes": 358305091,
    "upload_bytes": 5335283,
    "requests": 1512,
    "connections": 4,
    "payload_bytes": 1479823360,
    "source_sha256": "bea2ca4b8b197eb2e79353c7fa8e6a96bda0a2d516e182cd2488a13d5aff61f4",
    "payload_sha256": "b4fb4ed8f5d172b31acc26b0ef486f0d42bd6084f3d33c324672d2a5aca5754c",
    "bundle_bytes": 372591727,
    "bundle_sha256": "0b91d346dadd0ba1bd818f19e47f44346ef6c81388767dd08f80a054a6f497f8",
    "updater_sha256": "114c0cfdd96d1e2887514deec370332e8081a697ec34e1e90850b029fffe2d14",
    "plan_sha256": "b59422c87f5fec8ea7f64e9cf6e802723395e06853c24e91d52403af7b6c8cc6",
    "run_directory": ".cache/calculator/runs/major-rtt0-rugix-pipeline-casync16-0"
  },
  {
    "schema_version": 1,
    "workload": "major",
    "candidate": "rauc-http-32k",
    "repetition": 0,
    "rtt_ms": 0,
    "seconds": 50.793,
    "body_bytes": 518342395,
    "server_body_bytes": 518342395,
    "partial_http_responses": 0,
    "retransmitted_tcp_payload_bytes": 0,
    "download_bytes": 554561292,
    "upload_bytes": 9336159,
    "requests": 36876,
    "connections": 10,
    "payload_bytes": 1479823360,
    "source_sha256": "bea2ca4b8b197eb2e79353c7fa8e6a96bda0a2d516e182cd2488a13d5aff61f4",
    "payload_sha256": "b4fb4ed8f5d172b31acc26b0ef486f0d42bd6084f3d33c324672d2a5aca5754c",
    "bundle_bytes": 396908279,
    "bundle_sha256": "d1cbce825e46632d7e4238ca1cf071468def4e54bf62bd45d731df40db8a5d62",
    "updater_sha256": "2883423b6503da7df54ac15caa46ad95e306d1f78447ae75e75200db202c2cb8",
    "plan_sha256": "b59422c87f5fec8ea7f64e9cf6e802723395e06853c24e91d52403af7b6c8cc6",
    "run_directory": ".cache/calculator/runs/major-rtt0-rauc-http-32k-0"
  },
  {
    "schema_version": 1,
    "workload": "monthly",
    "candidate": "rugix-pipeline-casync16",
    "repetition": 0,
    "rtt_ms": 0,
    "seconds": 28.998,
    "body_bytes": 159652200,
    "server_body_bytes": 159652200,
    "partial_http_responses": 0,
    "retransmitted_tcp_payload_bytes": 3509,
    "download_bytes": 167973422,
    "upload_bytes": 2552502,
    "requests": 2892,
    "connections": 4,
    "payload_bytes": 1479823360,
    "source_sha256": "ee996c08051232c363ccc005a204992dac9458c4e70d5a3e53e2d04172e1eda5",
    "payload_sha256": "b4fb4ed8f5d172b31acc26b0ef486f0d42bd6084f3d33c324672d2a5aca5754c",
    "bundle_bytes": 372591727,
    "bundle_sha256": "0b91d346dadd0ba1bd818f19e47f44346ef6c81388767dd08f80a054a6f497f8",
    "updater_sha256": "114c0cfdd96d1e2887514deec370332e8081a697ec34e1e90850b029fffe2d14",
    "plan_sha256": "b59422c87f5fec8ea7f64e9cf6e802723395e06853c24e91d52403af7b6c8cc6",
    "run_directory": ".cache/calculator/runs/monthly-rtt0-rugix-pipeline-casync16-0"
  },
  {
    "schema_version": 1,
    "workload": "monthly",
    "candidate": "rauc-http-32k",
    "repetition": 0,
    "rtt_ms": 0,
    "seconds": 28.574,
    "body_bytes": 274618107,
    "server_body_bytes": 274618107,
    "partial_http_responses": 0,
    "retransmitted_tcp_payload_bytes": 0,
    "download_bytes": 293503161,
    "upload_bytes": 5085013,
    "requests": 18669,
    "connections": 9,
    "payload_bytes": 1479823360,
    "source_sha256": "ee996c08051232c363ccc005a204992dac9458c4e70d5a3e53e2d04172e1eda5",
    "payload_sha256": "b4fb4ed8f5d172b31acc26b0ef486f0d42bd6084f3d33c324672d2a5aca5754c",
    "bundle_bytes": 396908279,
    "bundle_sha256": "d1cbce825e46632d7e4238ca1cf071468def4e54bf62bd45d731df40db8a5d62",
    "updater_sha256": "2883423b6503da7df54ac15caa46ad95e306d1f78447ae75e75200db202c2cb8",
    "plan_sha256": "b59422c87f5fec8ea7f64e9cf6e802723395e06853c24e91d52403af7b6c8cc6",
    "run_directory": ".cache/calculator/runs/monthly-rtt0-rauc-http-32k-0"
  },
  {
    "schema_version": 1,
    "workload": "annual",
    "candidate": "rauc-http-32k",
    "repetition": 0,
    "rtt_ms": 0,
    "seconds": 41.661,
    "body_bytes": 340547323,
    "server_body_bytes": 340547323,
    "partial_http_responses": 0,
    "retransmitted_tcp_payload_bytes": 0,
    "download_bytes": 364300245,
    "upload_bytes": 6202735,
    "requests": 24163,
    "connections": 11,
    "payload_bytes": 1479823360,
    "source_sha256": "3c92eab91ad4f77efb029e27ae8c91f1570771e5eb04dcce4e472d3e63c28f75",
    "payload_sha256": "b4fb4ed8f5d172b31acc26b0ef486f0d42bd6084f3d33c324672d2a5aca5754c",
    "bundle_bytes": 396908279,
    "bundle_sha256": "d1cbce825e46632d7e4238ca1cf071468def4e54bf62bd45d731df40db8a5d62",
    "updater_sha256": "2883423b6503da7df54ac15caa46ad95e306d1f78447ae75e75200db202c2cb8",
    "plan_sha256": "b59422c87f5fec8ea7f64e9cf6e802723395e06853c24e91d52403af7b6c8cc6",
    "run_directory": ".cache/calculator/runs/annual-rtt0-rauc-http-32k-0"
  },
  {
    "schema_version": 1,
    "workload": "annual",
    "candidate": "rugix-pipeline-casync16",
    "repetition": 0,
    "rtt_ms": 0,
    "seconds": 28.086,
    "body_bytes": 205937136,
    "server_body_bytes": 205937136,
    "partial_http_responses": 0,
    "retransmitted_tcp_payload_bytes": 10569,
    "download_bytes": 216446363,
    "upload_bytes": 3099635,
    "requests": 3036,
    "connections": 4,
    "payload_bytes": 1479823360,
    "source_sha256": "3c92eab91ad4f77efb029e27ae8c91f1570771e5eb04dcce4e472d3e63c28f75",
    "payload_sha256": "b4fb4ed8f5d172b31acc26b0ef486f0d42bd6084f3d33c324672d2a5aca5754c",
    "bundle_bytes": 372591727,
    "bundle_sha256": "0b91d346dadd0ba1bd818f19e47f44346ef6c81388767dd08f80a054a6f497f8",
    "updater_sha256": "114c0cfdd96d1e2887514deec370332e8081a697ec34e1e90850b029fffe2d14",
    "plan_sha256": "b59422c87f5fec8ea7f64e9cf6e802723395e06853c24e91d52403af7b6c8cc6",
    "run_directory": ".cache/calculator/runs/annual-rtt0-rugix-pipeline-casync16-0"
  },
  {
    "schema_version": 1,
    "workload": "major",
    "candidate": "rauc-http-32k",
    "repetition": 1,
    "rtt_ms": 0,
    "seconds": 45.402,
    "body_bytes": 518342395,
    "server_body_bytes": 518342395,
    "partial_http_responses": 0,
    "retransmitted_tcp_payload_bytes": 4344,
    "download_bytes": 554565282,
    "upload_bytes": 9309543,
    "requests": 36876,
    "connections": 7,
    "payload_bytes": 1479823360,
    "source_sha256": "bea2ca4b8b197eb2e79353c7fa8e6a96bda0a2d516e182cd2488a13d5aff61f4",
    "payload_sha256": "b4fb4ed8f5d172b31acc26b0ef486f0d42bd6084f3d33c324672d2a5aca5754c",
    "bundle_bytes": 396908279,
    "bundle_sha256": "d1cbce825e46632d7e4238ca1cf071468def4e54bf62bd45d731df40db8a5d62",
    "updater_sha256": "2883423b6503da7df54ac15caa46ad95e306d1f78447ae75e75200db202c2cb8",
    "plan_sha256": "b59422c87f5fec8ea7f64e9cf6e802723395e06853c24e91d52403af7b6c8cc6",
    "run_directory": ".cache/calculator/runs/major-rtt0-rauc-http-32k-1"
  },
  {
    "schema_version": 1,
    "workload": "major",
    "candidate": "rugix-pipeline-casync16",
    "repetition": 1,
    "rtt_ms": 0,
    "seconds": 30.181,
    "body_bytes": 342120900,
    "server_body_bytes": 342120900,
    "partial_http_responses": 0,
    "retransmitted_tcp_payload_bytes": 1667,
    "download_bytes": 358304923,
    "upload_bytes": 5179805,
    "requests": 1512,
    "connections": 4,
    "payload_bytes": 1479823360,
    "source_sha256": "bea2ca4b8b197eb2e79353c7fa8e6a96bda0a2d516e182cd2488a13d5aff61f4",
    "payload_sha256": "b4fb4ed8f5d172b31acc26b0ef486f0d42bd6084f3d33c324672d2a5aca5754c",
    "bundle_bytes": 372591727,
    "bundle_sha256": "0b91d346dadd0ba1bd818f19e47f44346ef6c81388767dd08f80a054a6f497f8",
    "updater_sha256": "114c0cfdd96d1e2887514deec370332e8081a697ec34e1e90850b029fffe2d14",
    "plan_sha256": "b59422c87f5fec8ea7f64e9cf6e802723395e06853c24e91d52403af7b6c8cc6",
    "run_directory": ".cache/calculator/runs/major-rtt0-rugix-pipeline-casync16-1"
  },
  {
    "schema_version": 1,
    "workload": "monthly",
    "candidate": "rauc-http-32k",
    "repetition": 1,
    "rtt_ms": 0,
    "seconds": 37.305,
    "body_bytes": 274618107,
    "server_body_bytes": 274618107,
    "partial_http_responses": 0,
    "retransmitted_tcp_payload_bytes": 0,
    "download_bytes": 293503777,
    "upload_bytes": 4936133,
    "requests": 18670,
    "connections": 7,
    "payload_bytes": 1479823360,
    "source_sha256": "ee996c08051232c363ccc005a204992dac9458c4e70d5a3e53e2d04172e1eda5",
    "payload_sha256": "b4fb4ed8f5d172b31acc26b0ef486f0d42bd6084f3d33c324672d2a5aca5754c",
    "bundle_bytes": 396908279,
    "bundle_sha256": "d1cbce825e46632d7e4238ca1cf071468def4e54bf62bd45d731df40db8a5d62",
    "updater_sha256": "2883423b6503da7df54ac15caa46ad95e306d1f78447ae75e75200db202c2cb8",
    "plan_sha256": "b59422c87f5fec8ea7f64e9cf6e802723395e06853c24e91d52403af7b6c8cc6",
    "run_directory": ".cache/calculator/runs/monthly-rtt0-rauc-http-32k-1"
  },
  {
    "schema_version": 1,
    "workload": "monthly",
    "candidate": "rugix-pipeline-casync16",
    "repetition": 1,
    "rtt_ms": 0,
    "seconds": 29.52,
    "body_bytes": 159652200,
    "server_body_bytes": 159652200,
    "partial_http_responses": 0,
    "retransmitted_tcp_payload_bytes": 16418,
    "download_bytes": 167985077,
    "upload_bytes": 2593620,
    "requests": 2892,
    "connections": 4,
    "payload_bytes": 1479823360,
    "source_sha256": "ee996c08051232c363ccc005a204992dac9458c4e70d5a3e53e2d04172e1eda5",
    "payload_sha256": "b4fb4ed8f5d172b31acc26b0ef486f0d42bd6084f3d33c324672d2a5aca5754c",
    "bundle_bytes": 372591727,
    "bundle_sha256": "0b91d346dadd0ba1bd818f19e47f44346ef6c81388767dd08f80a054a6f497f8",
    "updater_sha256": "114c0cfdd96d1e2887514deec370332e8081a697ec34e1e90850b029fffe2d14",
    "plan_sha256": "b59422c87f5fec8ea7f64e9cf6e802723395e06853c24e91d52403af7b6c8cc6",
    "run_directory": ".cache/calculator/runs/monthly-rtt0-rugix-pipeline-casync16-1"
  },
  {
    "schema_version": 1,